Gray's Anatomy - 1918,https://www.bartleby.com/lit-hub/anatomy-of-the-human-body/,Digitalizovan칠 vyd치n칤 p콢vodn칤 Grayovy Anatomie,Anatomie 游,1. Ro캜n칤k,English
Anatomy Standard,https://www.anatomystandard.com/,"Interaktivn칤 anatomick칠 ilustrace, za pou쬴t칤 kvalitn칤ch 3D model콢",Anatomie 游,1. Ro캜n칤k,English
Radiopaedia,https://radiopaedia.org/?lang=us,"Radiologick치 wikipedie, ",Anatomie 游,1. Ro캜n칤k,English
Terminologia Anatomica 2.0,https://ta2viewer.openanatomy.org/,"N치stroj na prohled치v치n칤 kodifikovan칠ho n치zvoslov칤 anatomie Termonologia Anatomica 2.0, d치 se vyu쮂셦 k ov캩콏en칤 spr치vnosti anatomick칳ch n치zv콢 + poskytuje u쬴te캜n칠 odkazy k dal코칤mu studiu.",Anatomie 游,1. Ro캜n칤k,English
Anki - Anatomie,https://ankiweb.net/shared/by-author/1515663443,"Asi nelep코칤 Anki bal칤캜ek na anatomii, obsahuje popsan칠 obr치zky z u캜ebnice Anatomie 1,2,3 od profesora 캛ih치ka, bal칤캜ek je rozd캩len tak aby kop칤rovat postup v칳uky.",Anatomie 游,1. Ro캜n칤k,캛e코tina
Sam Webster,https://www.youtube.com/@SamWebster,"Britsk칳 anatom, kter칳 p콏ev치쬹캩 vyu쮂셨치 anatomick칠 modely, tato prezentace umo쬹칤 jednodu코eji pochopit vz치jemn칠 vztahy jednotliv칳ch struktur.",Anatomie 游,1. Ro캜n칤k,English
칔stav Anatomie LF2,https://www.youtube.com/@Ustavanatomie2LFUK,"V dob캩 distan캜n칤 v칳uky nahr치l 칔stav Anatomie LF.2 sv칠 p콏edn치코ky na YouTube, p콏edn치코칤 pan profesor David Kachl칤k.",Anatomie 游,1. Ro캜n칤k,캛e코tina
칔vod do CNS - LF3,http://www.cnsonline.cz/,"C칤lem tohoto kurzu je p콏edev코칤m usnadnit student콢m prvn칤 kroky v d쬿ngli, kterou CNS p콏edstavuje. ",Anatomie 游,1. Ro캜n칤k,캛e코tina
Anatom.cz,https://anatom.cz/,"Doprovodn치 webov치 str치nka k Memorix anatomii, umo쬹uje prozkou코t sv칠 znalosti anatomick칳ch struktur na dob콏e zn치m칳ch sch칠matech.",Anatomie 游,1. Ro캜n칤k,캛e코tina
Datab치ze sn칤mk콢 ze zobrazovac칤ch metod na webu Anatomick칠ho 칰stavu,https://anat.lf1.cuni.cz/materialy/zobrazeni.php,"Datab치ze radiologick칳ch sn칤mk콢 vhodn치 pro procvi캜en칤 rozpozn치v치n칤 anatomick칳ch struktur, pr콢b캩쬹칠 testy nav칤c tyto sn칤mky 캜asto pou쮂셨aj칤. ",Anatomie 游,1. Ro캜n칤k,캛e코tina
Anatomy Learning,https://anatomylearning.com/,"3D Anatomick칳 atlas, kter칳 je zdarma a funguje i v prohl칤쬰캜i.",Anatomie 游,1. Ro캜n칤k,English
WhoNamedIt?,https://www.whonamedit.com/,Slovn칤k l칠ka콏sk칳ch eponym,Anatomie 游,1. Ro캜n칤k,English
Feynmanovy p콏edn치코ky z fyziky,https://www.feynmanlectures.caltech.edu/,"Webov치 verze Feynmanov칳ch p콏edn치코ek z fyziky, Richard Feynman vynikal svoj칤 schopnost칤 vysv캩tlit slo쬴t칠 fyzik치ln칤 koncepty tak, aby byly snadn칠 na pochopen칤.",Biofyzika 丘뙖잺,1. Ro캜n칤k,English
HistologyGuide,https://histologyguide.com/,"Skv캩l치 datab치ze anotovan칳ch histologick칳ch prepar치t콢, pokud v치m nevyhovuje OlyVia nebo si ji jako u쬴vatel Macu nem콢쬰te st치hnout, p콏칤padn캩 si chcete pouze prohl칠dnout v칤ce prepar치t콢, bude pro V치s Histology guide v칳bornou alternativou.",Histologie 游댧,1. Ro캜n칤k,English
Histologick칳 atlas LF MU,https://is.muni.cz/do/rect/el/estud/lf/js18/histologie_atlas/web/index.html,"Jedn치 se o anotovan칠 obr치zky prepar치t콢 LF MU, oproti virtu치ln칤m mikroskop콢m umo쬹칤 jednodu코칤 orientaci",Histologie 游댧,1. Ro캜n칤k,캛e코tina
Wikiskripta - Mikroskop,https://mikroskop.wikiskripta.eu/,"Virtu치ln칤 mikroskop na Wikiskriptech, je dostupn칳 v prohl칤쬰캜i, bohu쬰l kategorizace prepar치t콢 nen칤 nejlep코칤 a n칠 v코echny prepar치ty jsou anatovan칠.",Histologie 游댧,1. Ro캜n칤k,캛e코tina
Junqueira - Mikroskop,http://medsci.indiana.edu/junqueira/virtual/junqueira.htm,"Virtuln칤 mikroskop Indiansk칠 Univerzity, obsahuje prepar치ty z Junqueirov칳ch z치klad콢 histologie.",Histologie 游댧,1. Ro캜n칤k,English
Procvi캜ov치n칤 z histologie - Wikiskripta,https://www.wikiskripta.eu/w/Procvi%C4%8Dov%C3%A1n%C3%AD:Testy_z_histologie,"Na Wikiskriptech jsou tak칠 cvi캜n칠 testy, vhodn칠 pro procvi캜en칤 p콏ed pr콢b캩쬹칳m nebo z치po캜tov칳m testem.",Histologie 游댧,1. Ro캜n칤k,캛e코tina
Histology Slides - UMICH,https://histology.medicine.umich.edu/full-slide-list,Dat치b치ze vitru치ln칤ch prepar치tu Michigansk치 univerzity,Histologie 游댧,1. Ro캜n칤k,English
Virtu치ln칤 mikroskop - LF3,https://slides.lf3.cuni.cz/,Datab치ze virtu치ln칤ch prepar치t콢 LF3. - vy쬬duje p콏ihl치코en칤 p콏es CAS,Histologie 游댧,1. Ro캜n칤k,캛e코tina
Video popisy histologick칳ch prepar치t콢 z LFP,https://www.youtube.com/watch?v=hWL9BLvYFeM&list=PL1VZpcaQ43L1Yu-uNZowbddqm5CPn5urA,"N캩kolikaminutov치 v칳ukov치 videa z LFP, dobr치 pro pochopen칤 toho, co m치 캜lov캩k na prepar치tu rozpoznat.",Histologie 游댧,1. Ro캜n칤k,캛e코tina
Histologick칳 atlas LFP UK,http://histologie.lfp.cuni.cz/preparaty/,"Jedn치 se o anotovan칠 obr치zky prepar치t콢 LFP UK, oproti virtu치ln칤m mikroskop콢m umo쬹칤 jednodu코칤 orientaci. ",Histologie 游댧,1. Ro캜n칤k,캛e코tina
Ustav histologie a embryologie LFP UK,https://www.youtube.com/@ustavhistologieaembryologi5741,"YouTube kan치l 칔stavu histologie a embryologie LFP UK, obsahuje spoustu u쬴te캜n칳ch a p콏ehledn칳ch sch칠mat z histologie a embryologie.",Histologie 游댧,1. Ro캜n칤k,캛e코tina
Latin Is Simple,https://www.latin-is-simple.com/,"Jednoduch칳 a modern칤 slovn칤k latiny, umo쮄갓je snadn칠 vyhled치v치n칤 jednotliv칳ch slov a jejich sklo켿ov치n칤.",Latina 游닄,1. Ro캜n칤k,English
Latina - Anki LF1,https://udl.lf1.cuni.cz/slovni-zasoba-pro-studenty-lek,Ofici치ln칤 Anki bal칤캜ek 칔stavu d캩jin l칠ka콏stv칤 a ciz칤ch jazyk콢 LF.1 - jedn치 se doporu캜enou slovn칤 z치sobu na zkou코ku z l칠ka콏sk칠 terminologie. ,Latina 游닄,1. Ro캜n칤k,캛e코tina
Medical Media,https://www.medicalmedia.eu/cs,"Platforma pro distan캜n칤 v칳uku, jsou zde z치znamy p콏edn치코ek z l칠ka콏sk칳ch fakult v 캛R.",S칤켿 sl치vy 救넖잺,V코echny,"캛e코tina, English"
PubMed,https://pubmed.ncbi.nlm.nih.gov/,Vyhled치va캜 odborn칳ch l칠ka콏sk칳ch 캜l치nk콢,S칤켿 sl치vy 救넖잺,V코echny,English
Wikiskripta,https://www.wikiskripta.eu/w/Home,"Str치nka, kterou nepochybn캩 zn치te, online zdoj pro mediky 캜칤slo jedna, obsahuje p콏ev치쬹캩 v칳ukov칠 캜l치nky, ale tak칠 virtu치ln칤 mikroskop, prociv캜ov치n칤, kalkua캜ky a mnoho dal코칤. (Nav코tivte na코i sekci n치vody)  ",S칤켿 sl치vy 救넖잺,V코echny,캛e코tina
Anki,https://apps.ankiweb.net/,"Desktopov칳 program na tvorbu flashcards, je zcela zdarma a open source, jedn치 se o slo쬴t캩j코칤 program, kter칳 vy쬬duje trochu 캜asu, ale je neskute캜n캩 flexibiln칤. (Koukni se do sekce n치vody) ",S칤켿 sl치vy 救넖잺,V코echny,English
OpenStax,https://openstax.org/subjects/science,OpenSource u캜ebnice,S칤켿 sl치vy 救넖잺,V코echny,English
Quizlet,https://quizlet.com/,"Webov칳 ekvivalent k Anki, umo쮄갓je snadn칠 sd칤len칤 bal칤캜k콢 a m치 jednodu코칤 rozhran칤, bohu쬰l pokro캜il칠 funkce jsou zam캜en칠 pod p콏edplatn칳m. ",S칤켿 sl치vy 救넖잺,V코echny,English
Virtu치ln칤 patologie,https://www.virtualpathology.leeds.ac.uk/,"Port치l virtu치ln칤 patologie, ",Patologie 游,3. Ro캜n칤k,English
Andrea Fel코칬ov치,https://www.youtube.com/channel/UCYvSIOkPeo3TqaxdacRKC9w/videos,"Youtube kan치l Andrey Fel코칬ov칠, v캩nuje se hlavn캩 histologii",Histologie 游댧,1. Ro캜n칤k,Slov캩n코tina
UBC Neuroanatomy,http://www.neuroanatomy.ca,"Port치l 칰vodu do neuroanatomie Univerzity Britsk칠 Kolumbie, obsahuje kvalitn칤 videa a interaktivn칤 콏ezy mozkem",Anatomie 游,1. Ro캜n칤k,English
FFix it!,https://www.youtube.com/channel/UCfbcnP185VNy9QywFMPQBjw,"Youtube kan치l Andrey Fel코칬ov칠, v캩nuje se histologii a patologii",Histologie 游댧,1. Ro캜n칤k,English
Skelet 3D,http://skelet3d.lf3.cuni.cz/index.xhtml,3D Atlas kost칤 v prohl칤쬰캜i,Anatomie 游,1. Ro캜n칤k,캛e코tina
The Plastinated Brain,http://www.meduniwien.ac.at/plastination/plastinatedbrain/main.html,콎ezy mozkem,Anatomie 游,1. Ro캜n칤k,English
The Whole Brain Atlas,www.med.harvard.edu/AANLIB/,Atlas neuroanatomie Harvardsk칠 univerzity,Anatomie 游,1. Ro캜n칤k,English
Histologick칳 atlas LF.2 UK,https://histo-atlas.eu/,"Histologick칳 atlas LF.2 UK, obsahuje virtu치ln칤 mikroksop s popisem jednotliv칳ch prepar치t콢",Histologie 游댧,1. Ro캜n칤k,캛e코tina
Neuroanatomie,https://publi.cz/books/219/index.html?secured=false#Cover,"Online u캜ebnice neuroanatomize z LFHK, poskytuje studijn칤 materi치l a z치rove켿 zaji코tuje zp캩tnou vazbu v podob캩 test콢.",Anatomie 游,1. Ro캜n칤k,캛e코tina
Neuroanatomie UPOL,https://www.nan.upol.cz/neuro/index.html,Neuroanatomie LF UPOL,Anatomie 游,1. Ro캜n칤k,캛e코tina
Radiology Web Lab,http://uwmsk.org/,Interaktivn칤 CT 콏ezy,Anatomie 游,1. Ro캜n칤k,English